{
  "id": "root",
  "header": {
    "id": "header",
    "type": "header",
    "title": "Header",
    "latex": "\\begin{center}\n    \\textbf{\\Huge \\scshape Jake Ryan} \\\\ \\vspace{1pt}\n    \\small 123-456-7890 $|$ \\href{mailto:x@x.com}{\\underline{jake@su.edu}} $|$\n    \\href{https://linkedin.com/in/...}{\\underline{linkedin.com/in/jake}} $|$\n    \\href{https://github.com/...}{\\underline{github.com/jake}}\n\\end{center}",
    "tags": [],
    "children": []
  },
  "sections": [
    {
      "id": "sec-education",
      "type": "section",
      "title": "Education",
      "latex": "\\section{Education}\n\\resumeSubHeadingListStart\n{{children}}\n\\resumeSubHeadingListEnd",
      "tags": [],
      "children": [
        {
          "id": "edu-1",
          "type": "section_text",
          "title": "Southwestern University",
          "latex": "\\resumeSubheading\n  {Southwestern University}{Georgetown, TX}\n  {Bachelor of Arts in Computer Science, Minor in Business}{Aug. 2018 -- May 2021}",
          "tags": [],
          "children": []
        },
        {
          "id": "edu-2",
          "type": "section_text",
          "title": "Blinn College",
          "latex": "\\resumeSubheading\n  {Blinn College}{Bryan, TX}\n  {Associate's in Liberal Arts}{Aug. 2014 -- May 2018}",
          "tags": [],
          "children": []
        }
      ]
    },
    {
      "id": "sec-experience",
      "type": "section",
      "title": "Experience",
      "latex": "\\section{Experience}\n\\resumeSubHeadingListStart\n{{children}}\n\\resumeSubHeadingListEnd",
      "tags": [],
      "children": [
        {
          "id": "exp-1",
          "type": "subsection",
          "title": "Texas A&M University: Undergraduate Research Assistant",
          "latex": "\\resumeSubheading\n  {Undergraduate Research Assistant}{June 2020 -- Present}\n  {Texas A\\&M University}{College Station, TX}\n\\resumeItemListStart\n{{children}}\n\\resumeItemListEnd",
          "tags": [],
          "children": [
            {
              "id": "exp-1-b1",
              "type": "subsection_text",
              "title": "Developed a REST API using FastAPI and PostgreSQL to store d",
              "latex": "\\resumeItem{Developed a REST API using FastAPI and PostgreSQL to store data from learning management systems}",
              "tags": [],
              "children": []
            },
            {
              "id": "exp-1-b2",
              "type": "subsection_text",
              "title": "Developed a full-stack web application using Flask, React, P",
              "latex": "\\resumeItem{Developed a full-stack web application using Flask, React, PostgreSQL and Docker to analyze GitHub data}",
              "tags": [],
              "children": []
            },
            {
              "id": "exp-1-b3",
              "type": "subsection_text",
              "title": "Explored ways to visualize GitHub collaboration in a classro",
              "latex": "\\resumeItem{Explored ways to visualize GitHub collaboration in a classroom setting}",
              "tags": [],
              "children": []
            }
          ]
        },
        {
          "id": "exp-2",
          "type": "subsection",
          "title": "Southwestern University: IT Support Specialist",
          "latex": "\\resumeSubheading\n  {Information Technology Support Specialist}{Sep. 2018 -- Present}\n  {Southwestern University}{Georgetown, TX}\n\\resumeItemListStart\n{{children}}\n\\resumeItemListEnd",
          "tags": [],
          "children": [
            {
              "id": "exp-2-b1",
              "type": "subsection_text",
              "title": "Communicate with managers to set up campus computers used on",
              "latex": "\\resumeItem{Communicate with managers to set up campus computers used on campus}",
              "tags": [],
              "children": []
            },
            {
              "id": "exp-2-b2",
              "type": "subsection_text",
              "title": "Assess and troubleshoot computer problems brought by student",
              "latex": "\\resumeItem{Assess and troubleshoot computer problems brought by students, faculty and staff}",
              "tags": [],
              "children": []
            },
            {
              "id": "exp-2-b3",
              "type": "subsection_text",
              "title": "Maintain upkeep of computers, classroom equipment, and 200 p",
              "latex": "\\resumeItem{Maintain upkeep of computers, classroom equipment, and 200 printers across campus}",
              "tags": [],
              "children": []
            }
          ]
        },
        {
          "id": "exp-3",
          "type": "subsection",
          "title": "Southwestern University: AI Research Assistant",
          "latex": "\\resumeSubheading\n  {Artificial Intelligence Research Assistant}{May 2019 -- July 2019}\n  {Southwestern University}{Georgetown, TX}\n\\resumeItemListStart\n{{children}}\n\\resumeItemListEnd",
          "tags": [],
          "children": [
            {
              "id": "exp-3-b1",
              "type": "subsection_text",
              "title": "Explored methods to generate video game dungeons based off o",
              "latex": "\\resumeItem{Explored methods to generate video game dungeons based off of \\emph{The Legend of Zelda}}",
              "tags": [],
              "children": []
            },
            {
              "id": "exp-3-b2",
              "type": "subsection_text",
              "title": "Developed a game in Java to test the generated dungeons",
              "latex": "\\resumeItem{Developed a game in Java to test the generated dungeons}",
              "tags": [],
              "children": []
            },
            {
              "id": "exp-3-b3",
              "type": "subsection_text",
              "title": "Contributed 50K+ lines of code to an established codebase vi",
              "latex": "\\resumeItem{Contributed 50K+ lines of code to an established codebase via Git}",
              "tags": [],
              "children": []
            },
            {
              "id": "exp-3-b4",
              "type": "subsection_text",
              "title": "Conducted  a human subject study to determine which video ga",
              "latex": "\\resumeItem{Conducted  a human subject study to determine which video game dungeon generation technique is enjoyable}",
              "tags": [],
              "children": []
            },
            {
              "id": "exp-3-b5",
              "type": "subsection_text",
              "title": "Wrote an 8-page paper and gave multiple presentations on-cam",
              "latex": "\\resumeItem{Wrote an 8-page paper and gave multiple presentations on-campus}",
              "tags": [],
              "children": []
            },
            {
              "id": "exp-3-b6",
              "type": "subsection_text",
              "title": "Presented virtually to the World Conference on Computational",
              "latex": "\\resumeItem{Presented virtually to the World Conference on Computational Intelligence}",
              "tags": [],
              "children": []
            }
          ]
        }
      ]
    },
    {
      "id": "sec-projects",
      "type": "section",
      "title": "Projects",
      "latex": "\\section{Projects}\n\\resumeSubHeadingListStart\n{{children}}\n\\resumeSubHeadingListEnd",
      "tags": [],
      "children": [
        {
          "id": "proj-1",
          "type": "subsection",
          "title": "Gitlytics",
          "latex": "\\resumeProjectHeading\n  {\\textbf{Gitlytics} $|$ \\emph{Python, Flask, React, PostgreSQL, Docker}}{June 2020 -- Present}\n\\resumeItemListStart\n{{children}}\n\\resumeItemListEnd",
          "tags": [],
          "children": [
            {
              "id": "proj-1-b1",
              "type": "subsection_text",
              "title": "Developed a full-stack web application using with Flask serv",
              "latex": "\\resumeItem{Developed a full-stack web application using with Flask serving a REST API with React as the frontend}",
              "tags": [],
              "children": []
            },
            {
              "id": "proj-1-b2",
              "type": "subsection_text",
              "title": "Implemented GitHub OAuth to get data from user’s repositorie",
              "latex": "\\resumeItem{Implemented GitHub OAuth to get data from user’s repositories}",
              "tags": [],
              "children": []
            },
            {
              "id": "proj-1-b3",
              "type": "subsection_text",
              "title": "Visualized GitHub data to show collaboration",
              "latex": "\\resumeItem{Visualized GitHub data to show collaboration}",
              "tags": [],
              "children": []
            },
            {
              "id": "proj-1-b4",
              "type": "subsection_text",
              "title": "Used Celery and Redis for asynchronous tasks",
              "latex": "\\resumeItem{Used Celery and Redis for asynchronous tasks}",
              "tags": [],
              "children": []
            }
          ]
        },
        {
          "id": "proj-2",
          "type": "subsection",
          "title": "Simple Paintball",
          "latex": "\\resumeProjectHeading\n  {\\textbf{Simple Paintball} $|$ \\emph{Spigot API, Java, Maven, TravisCI, Git}}{May 2018 -- May 2020}\n\\resumeItemListStart\n{{children}}\n\\resumeItemListEnd",
          "tags": [],
          "children": [
            {
              "id": "proj-2-b1",
              "type": "subsection_text",
              "title": "Developed a Minecraft server plugin to entertain kids during",
              "latex": "\\resumeItem{Developed a Minecraft server plugin to entertain kids during free time for a previous job}",
              "tags": [],
              "children": []
            },
            {
              "id": "proj-2-b2",